{
  "schema_version": "v1",
  "run_id": "run-123",
  "collected_at": "2026-10-22T01:25:00Z",
  "start_ts": "2026-10-22T01:20:00Z",
  "end_ts": "2026-10-22T01:25:00Z",
  "cache_before_ref": "cache_before.json",
  "cache_after_ref": "cache_after.json",
  "restore_timings_ref": "restore_timings.jsonl",
  "logs_archive": "logs/run-123.tar.gz",
  "prom_metrics": [
    {
      "name": "atelet_restore_total",
      "labels": { "node": "node-1" },
      "status": "ok",
      "value": 0
    }
  ],
  "server_summary": {
    "api_p99_ms": {
      "count": 120,
      "p50": 14.2,
      "p90": 28.5,
      "p95": 35.1,
      "p99": 48.0,
      "max": 62.3,
      "unit": "ms"
    }
  },
  "custom_metrics": {
    "overlay_prefetch_queue_depth": {
      "count": 5,
      "min": 0.0,
      "max": 4.0,
      "p50": 2.0,
      "p95": 4.0,
      "unit": "items"
    }
  }
}
